Postgres -

1. Create Database ipl-

postgres=# Create database ipl;
CREATE DATABASE

2. Drop Database ipl -

postgres=# Drop database ipl;
DROP DATABASE

3. Create Table-

postgres=# \c ipl
You are now connected to database "ipl" as user "postgres".
ipl=# \dt
Did not find any relations.
ipl=# Create table Team(Name varchar not null,
ipl(# Id Int Primary key not null,
ipl(# No_of_players int not null,
ipl(# homeground varchar not null
ipl(# );
CREATE TABLE


4. Drop Table-

postgres=# Drop table ipl;
DROP TABLE

5. Inserting data - 

postgres=# \c ipl
ipl=# Insert into team values('chennai super kings',1,20,'chennai');
INSERT 0 1

ipl=# Insert into team values('Royal challenger bangalore',2,18,'bangalore');
INSERT 0 1

ipl=# Insert into team values('Mumbai indians',3,20,'Mumbai');
INSERT 0 1

ipl=# Insert into team values('delhi capitals',4,17,'delhi');
INSERT 0 1


6. Select -

ipl=# Select * from team;
            name            | id | no_of_players | homeground 
----------------------------+----+---------------+------------
 chennai super kings        |  1 |            20 | chennai
 Royal challenger bangalore |  2 |            18 | bangalore
 Mumbai indians             |  3 |            20 | Mumbai
 delhi capitals             |  4 |            17 | delhi
(4 rows)


7. Operators -

a. arithmatic operators - +,-,/,*,% etc.
b. comparison operators - =,!=,<,>,<=,>=,<>.
c. Logical operators - AND , NOT & OR.
d. Bitwise operators - & ,| ,<< , >>

8. where clause -

ipl=# select * from team where no_of_players >18;
        name         | id | no_of_players | homeground 
---------------------+----+---------------+------------
 chennai super kings |  1 |            20 | chennai
 Mumbai indians      |  3 |            20 | Mumbai
(2 rows)


ipl=# select * from team where homeground LIKE 'ban%';
            name            | id | no_of_players | homeground 
----------------------------+----+---------------+------------
 Royal challenger bangalore |  2 |            18 | bangalore
(1 row)


9. AND & OR clause -

ipl=# select * from team where id<4 and id>2;
      name      | id | no_of_players | homeground 
----------------+----+---------------+------------
 Mumbai indians |  3 |            20 | Mumbai
(1 row)


ipl=# select * from team where id<=2 or id>3;
            name            | id | no_of_players | homeground 
----------------------------+----+---------------+------------
 chennai super kings        |  1 |            20 | chennai
 Royal challenger bangalore |  2 |            18 | bangalore

10. Alter table - (adding column into table team ) -

ipl=# alter table team add column budget int;
ALTER TABLE
ipl=# select * from team;
            name            | id | no_of_players | homeground | budget 
----------------------------+----+---------------+------------+--------
 chennai super kings        |  1 |            20 | chennai    |       
 Royal challenger bangalore |  2 |            18 | bangalore  |       
 Mumbai indians             |  3 |            20 | Mumbai     |       
 delhi capitals             |  4 |            17 | delhi      |       


11. Update query -

ipl=# update team set budget=800000000 where id=1;
UPDATE 1
ipl=# select * from team;
            name            | id | no_of_players | homeground |  budget   
----------------------------+----+---------------+------------+-----------
 Royal challenger bangalore |  2 |            18 | bangalore  |          
 Mumbai indians             |  3 |            20 | Mumbai     |          
 delhi capitals             |  4 |            17 | delhi      |          
 chennai super kings        |  1 |            20 | chennai    | 800000000

ipl=# insert into team values('chennai kings',6,18,'chennai',800000000);
INSERT 0 1
ipl=# select * from team;
            name            | id | no_of_players | homeground |  budget   
----------------------------+----+---------------+------------+-----------
 chennai super kings        |  1 |            20 | chennai    | 800000000
 Royal challenger bangalore |  2 |            18 | bangalore  | 700000000
 Mumbai indians             |  3 |            20 | Mumbai     | 720000000
 delhi capitals             |  4 |            17 | delhi      | 800000000
 king x1 punjab             |  5 |            21 | mohali     | 800000000
 chennai kings              |  6 |            18 | chennai    | 800000000


12. ipl=# Delete from team where id=6;
DELETE 1

13. LIKE Clause - ipl=# select * from team where budget::text LIKE '72%';
      name      | id | no_of_players | homeground |  budget   ipl=# select * from team where budget::text LIKE '72%';
      name      | id | no_of_players | homeground |  budget   
----------------+----+---------------+------------+-----------
 Mumbai indians |  3 |            20 | Mumbai     | 720000000

----------------+----+---------------+------------+-----------
 Mumbai indians |  3 |            20 | Mumbai     | 720000000


ipl=# select * from team where homeground like 'ban%';
            name            | id | no_of_players | homeground |  budget   
----------------------------+----+---------------+------------+-----------
 Royal challenger bangalore |  2 |            18 | bangalore  | 700000000

14. Limit clause -

ipl=# select * from team Limit 3;
            name            | id | no_of_players | homeground |  budget   
----------------------------+----+---------------+------------+-----------
 chennai super kings        |  1 |            20 | chennai    | 800000000
 Royal challenger bangalore |  2 |            18 | bangalore  | 700000000
 Mumbai indians             |  3 |            20 | Mumbai     | 720000000

15. Order by Clause -

ipl=# select * from team order by name;
            name            | id | no_of_players | homeground |  budget   
----------------------------+----+---------------+------------+-----------
 chennai super kings        |  1 |            20 | chennai    | 800000000
 delhi capitals             |  4 |            17 | delhi      | 800000000
 king x1 punjab             |  5 |            21 | mohali     | 800000000
 Mumbai indians             |  3 |            20 | Mumbai     | 720000000
 Royal challenger bangalore |  2 |            18 | bangalore  | 700000000



16. Group by clause -

ipl=# select player_id, sum(sold_at) from player group by player_id;
 player_id |    sum    
-----------+-----------
         3 |  95000000
         2 | 110000000
         1 |  18000000

17. distinct clause -

ipl=# select distinct player_id from player;
 player_id 
-----------
         3
         2
         1

18. Constraints ( Primary key , foreign key , not null , unique, check constraints)

ipl=# create Database contraints;
CREATE DATABASE
ipl=# create table company1(Id INT PRIMARY KEY NOT NULL,
ipl(# NAME TEXT NOT NULL,
ipl(# AGE INT NOT NULL UNIQUE,
ipl(# City TEXT ,
ipl(# Salary varchar
ipl(# );
CREATE TABLE


ipl=# create table department1(ID int primary key not null,
ipl(# dept text not null,
ipl(# emp_id int references company1(id)
ipl(# );
CREATE TABLE


ipl=# create table company2(ID int primary key not null,
ipl(# name text not null,
ipl(# age int not null unique,
ipl(# salary REAL check(salary>10000)
ipl(# );
CREATE TABLE


19. cross Join -  

ipl=# select player_name,player_id from player cross join team limit 10; ( used limit because it will take more space to copy that result here).
   player_name    | player_id 
------------------+-----------
 virat kohli      |         2
 virat kohli      |         2
 virat kohli      |         2
 virat kohli      |         2
 virat kohli      |         2
 virat kohli      |         2
 virat kohli      |         2
 virat kohli      |         2
 devdutt paddikal |         2
 devdutt paddikal |         2

20. Inner join - It matches each row of table1 with each row of table 2 based upon join-predicate.

ipl=# select player_name, player_id , sold_for from player inner join team on team.id=player.player_id;
   player_name    | player_id | sold_for 
------------------+-----------+----------
 virat kohli      |         2 | RCB
 devdutt paddikal |         2 | RCB
 Ms dhoni         |         1 | csk
 suresh Raina     |         1 | csk
 Rohit sharma     |         3 | MI
 Bumrah           |         3 | MI

21. Left Outer Join - It gives matching rows and the rows which are in left table but not in right table.

ipl=# select player_name , player_id, sold_for,sold_at from player left outer join team on (player.owner=team.owner);
   player_name    | player_id | sold_for |  sold_at  
------------------+-----------+----------+-----------
 virat kohli      |         2 | RCB      | 100000000
 devdutt paddikal |         2 | RCB      |  10000000
 Ms dhoni         |         1 | csk      |  10000000
 suresh Raina     |         1 | csk      |   8000000
 Rohit sharma     |         3 | MI       |  90000000
 Bumrah           |         3 | MI       |   5000000
(6 rows)


22. Right outer join - It gives matching rows and the rows which are in right table but not in left table.

ipl=# select name ,id,sold_for,sold_at,player_name from player right outer join team on (player.owner=team.owner);
            name            | id | sold_for |  sold_at  |   player_name    
----------------------------+----+----------+-----------+------------------
 chennai super kings        |  1 | csk      |   8000000 | suresh Raina
 chennai super kings        |  1 | csk      |  10000000 | Ms dhoni
 Royal challenger bangalore |  2 | RCB      |  10000000 | devdutt paddikal
 Royal challenger bangalore |  2 | RCB      | 100000000 | virat kohli
 Mumbai indians             |  3 | MI       |   5000000 | Bumrah
 Mumbai indians             |  3 | MI       |  90000000 | Rohit sharma
 delhi capitals             |  4 |          |           | 
 king x1 punjab             |  5 |          |           | 
 sunriser hyderabad         |  6 |          |           | 
 kolkata knight rider       |  7 |          |           | 
 Rajasthan Royals           |  8 |          |           | 
(11 rows)

23. full outer join - it gives full data like data from left table,right table and also matching rows on the given condition.


ipl=# select name,player_name,id,Player_id,sold_for,sold_at,budget from player right outer join team on (player.owner=team.owner);
            name            |   player_name    | id | player_id | sold_for |  sold_at  |  budget   
----------------------------+------------------+----+-----------+----------+-----------+-----------
 chennai super kings        | suresh Raina     |  1 |         1 | csk      |   8000000 | 800000000
 chennai super kings        | Ms dhoni         |  1 |         1 | csk      |  10000000 | 800000000
 Royal challenger bangalore | devdutt paddikal |  2 |         2 | RCB      |  10000000 | 700000000
 Royal challenger bangalore | virat kohli      |  2 |         2 | RCB      | 100000000 | 700000000
 Mumbai indians             | Bumrah           |  3 |         3 | MI       |   5000000 | 720000000
 Mumbai indians             | Rohit sharma     |  3 |         3 | MI       |  90000000 | 720000000
 delhi capitals             |                  |  4 |           |          |           | 800000000
 king x1 punjab             |                  |  5 |           |          |           | 800000000
 sunriser hyderabad         |                  |  6 |           |          |           | 780000000
 kolkata knight rider       |                  |  7 |           |          |           | 790000000
 Rajasthan Royals           |                  |  8 |           |          |           | 790000000


24. delete/drop query-

to delete column -
ipl=# alter table company1 drop column salary;
ALTER TABLE

to delete a row -
ipl=# Delete from company1 where age=20;
DELETE 1












